<?xml version="1.0" encoding="utf-8" ?>
<!DOCTYPE component-info
      PUBLIC "-//AVALON/Component Info DTD Version 1.0//EN"
             "http://avalon.apache.org/dtds/info/componentinfo_1_0.dtd" >

<component-info>
    <component type="org.realityforge.Component1"/>

    <loggers>
        <logger/>
        <logger name="audit"/>
    </loggers>

    <context type="org.apache.avalon.phoenix.BlockContext">
        <entry key="mbean" type="javax.jmx.MBeanServer"/>
    </context>

    <services>
        <service type="org.realityforge.Service1">
            <attribute name="doc">
                <param name="display-name" value="Special Service"/>
                <param name="description-key" value="service1.desc"/>
            </attribute>
        </service>
    </services>

    <dependencies>
        <dependency type="org.realityforge.Service2" optional="true" />
        <dependency key="foo" type="org.realityforge.Service3"/>
    </dependencies>

    <configuration-schema type="http://relaxng.org/ns/structure/1.0"/>
</component-info>
